<?xml version="1.0" encoding="UTF-8" standalone="no"?>
<SYSTEMS xmlns="http://www.fb10.uni-bremen.de/anglistik/langpro/kpml/README.html" xmlns:xsi="http://www.w3.org/2001/XMLSchema-instance" xsi:schemaLocation="http://www.fb10.uni-bremen.de/anglistik/langpro/kpml/README.html kpml.system.xsd">
    <COMMENTS/>
    <IN-REGION>experiential-functions</IN-REGION>
    <IN-LANGUAGE/>
    <SYSTEM>
        <SYSTEM-TYPE>SYSTEM</SYSTEM-TYPE>
        <NAME>RELATIONAL-MODE</NAME>
        <INPUTS>
            <s>relational</s>
        </INPUTS>
        <OUTPUTS>
            <out>
                <probability>0.5</probability>
                <feature>attributive</feature>
                <realization>
                    <insert>
                        <a>Carrier</a>
                    </insert>
                    <insert>
                        <a>Attribute</a>
                    </insert>
                </realization>
            </out>
            <out>
                <probability>0.5</probability>
                <feature>identifying</feature>
                <realization>
                    <insert>
                        <a>Token</a>
                    </insert>
                    <insert>
                        <a>Value</a>
                    </insert>
                </realization>
            </out>
        </OUTPUTS>
        <CHOOSER>RELATIONAL-MODE-CHOOSER</CHOOSER>
        <REGION>experiential-functions</REGION>
        <METAFUNCTION>IDEATIONAL</METAFUNCTION>
    </SYSTEM>
    <SYSTEM>
        <SYSTEM-TYPE>SYSTEM</SYSTEM-TYPE>
        <NAME>RELATIONAL</NAME>
        <INPUTS>
            <s>relational2</s>
        </INPUTS>
        <OUTPUTS>
            <out>
                <probability>0.3333333333333333</probability>
                <feature>epithet</feature>
            </out>
            <out>
                <probability>0.3333333333333333</probability>
                <feature>possessive2</feature>
            </out>
            <out>
                <probability>0.3333333333333333</probability>
                <feature>incidental2</feature>
            </out>
        </OUTPUTS>
        <CHOOSER>RELATIONAL-CHOOSER</CHOOSER>
        <REGION>experiential-functions</REGION>
        <METAFUNCTION>IDEATIONAL</METAFUNCTION>
    </SYSTEM>
    <SYSTEM>
        <SYSTEM-TYPE>SYSTEM</SYSTEM-TYPE>
        <NAME>RELATIONAL-TYPE2</NAME>
        <INPUTS>
            <s>relational-participant</s>
        </INPUTS>
        <OUTPUTS>
            <out>
                <probability>0.5</probability>
                <feature>carrier</feature>
            </out>
            <out>
                <probability>0.5</probability>
                <feature>attribute</feature>
            </out>
        </OUTPUTS>
        <CHOOSER>RELATIONAL-TYPE2-CHOOSER</CHOOSER>
        <REGION>experiential-functions</REGION>
        <METAFUNCTION>IDEATIONAL</METAFUNCTION>
    </SYSTEM>
    <SYSTEM>
        <SYSTEM-TYPE>SYSTEM</SYSTEM-TYPE>
        <NAME>RELATIONAL-TYPE1</NAME>
        <INPUTS>
            <s>relational-participant</s>
        </INPUTS>
        <OUTPUTS>
            <out>
                <probability>0.14285714285714285</probability>
                <feature>possessor</feature>
            </out>
            <out>
                <probability>0.14285714285714285</probability>
                <feature>possessed</feature>
            </out>
            <out>
                <probability>0.14285714285714285</probability>
                <feature>domain</feature>
            </out>
            <out>
                <probability>0.14285714285714285</probability>
                <feature>range</feature>
            </out>
            <out>
                <probability>0.14285714285714285</probability>
                <feature>incidence</feature>
            </out>
            <out>
                <probability>0.14285714285714285</probability>
                <feature>entity</feature>
            </out>
            <out>
                <probability>0.14285714285714285</probability>
                <feature>property</feature>
            </out>
        </OUTPUTS>
        <CHOOSER>RELATIONAL-TYPE1-CHOOSER</CHOOSER>
        <REGION>experiential-functions</REGION>
        <METAFUNCTION>IDEATIONAL</METAFUNCTION>
    </SYSTEM>
    <SYSTEM>
        <SYSTEM-TYPE>SYSTEM</SYSTEM-TYPE>
        <NAME>CLAUSE-TYPE</NAME>
        <INPUTS>
            <s>clause</s>
        </INPUTS>
        <OUTPUTS>
            <out>
                <probability>0.5</probability>
                <feature>being-and-having</feature>
            </out>
            <out>
                <probability>0.5</probability>
                <feature>doing-and-happening</feature>
            </out>
        </OUTPUTS>
        <CHOOSER>CLAUSE-TYPE-CHOOSER</CHOOSER>
        <REGION>experiential-functions</REGION>
        <METAFUNCTION>IDEATIONAL</METAFUNCTION>
    </SYSTEM>
    <SYSTEM>
        <SYSTEM-TYPE>SYSTEM</SYSTEM-TYPE>
        <NAME>EXPERITIAL-DOWNRANKED</NAME>
        <INPUTS>
            <s>downranked</s>
        </INPUTS>
        <OUTPUTS>
            <out>
                <probability>0.5</probability>
                <feature>relational2</feature>
            </out>
            <out>
                <probability>0.5</probability>
                <feature>thing</feature>
            </out>
        </OUTPUTS>
        <CHOOSER>EXPERITIAL-DOWNRANKED-CHOOSER</CHOOSER>
        <REGION>experiential-functions</REGION>
        <METAFUNCTION>IDEATIONAL</METAFUNCTION>
    </SYSTEM>
    <SYSTEM>
        <SYSTEM-TYPE>SYSTEM</SYSTEM-TYPE>
        <NAME>RANK</NAME>
        <INPUTS>
            <s>wording</s>
        </INPUTS>
        <OUTPUTS>
            <out>
                <probability>0.5</probability>
                <feature>clause</feature>
            </out>
            <out>
                <probability>0.5</probability>
                <feature>group-phrase</feature>
            </out>
        </OUTPUTS>
        <CHOOSER>RANK-CHOOSER</CHOOSER>
        <REGION>experiential-functions</REGION>
        <METAFUNCTION>IDEATIONAL</METAFUNCTION>
    </SYSTEM>
    <SYSTEM>
        <SYSTEM-TYPE>SYSTEM</SYSTEM-TYPE>
        <NAME>INTERPERSONAL-DOWNRANKED</NAME>
        <INPUTS>
            <s>downranked</s>
        </INPUTS>
        <OUTPUTS>
            <out>
                <probability>0.5</probability>
                <feature>head</feature>
            </out>
            <out>
                <probability>0.5</probability>
                <feature>modifier</feature>
            </out>
        </OUTPUTS>
        <CHOOSER>INTERPERSONAL-DOWNRANKED-CHOOSER</CHOOSER>
        <REGION>experiential-functions</REGION>
        <METAFUNCTION>IDEATIONAL</METAFUNCTION>
    </SYSTEM>
    <SYSTEM>
        <SYSTEM-TYPE>SYSTEM</SYSTEM-TYPE>
        <NAME>POSSESSIVE-DIATHESIS</NAME>
        <INPUTS>
            <s>possessive</s>
        </INPUTS>
        <OUTPUTS>
            <out>
                <probability>0.5</probability>
                <feature>having-type</feature>
            </out>
            <out>
                <probability>0.5</probability>
                <feature>belonging-type</feature>
            </out>
        </OUTPUTS>
        <CHOOSER>POSSESSIVE-DIATHESIS-CHOOSER</CHOOSER>
        <REGION>experiential-functions</REGION>
        <METAFUNCTION>IDEATIONAL</METAFUNCTION>
    </SYSTEM>
    <SYSTEM>
        <SYSTEM-TYPE>SYSTEM</SYSTEM-TYPE>
        <NAME>RELATIONAL-TYPE</NAME>
        <INPUTS>
            <s>relational</s>
        </INPUTS>
        <OUTPUTS>
            <out>
                <probability>0.3333333333333333</probability>
                <feature>intrinsic</feature>
            </out>
            <out>
                <probability>0.3333333333333333</probability>
                <feature>incidental</feature>
            </out>
            <out>
                <probability>0.3333333333333333</probability>
                <feature>possessive</feature>
                <realization>
                    <insert>
                        <a>Possessor</a>
                    </insert>
                    <insert>
                        <a>Possessed</a>
                    </insert>
                </realization>
            </out>
        </OUTPUTS>
        <CHOOSER>RELATIONAL-TYPE-CHOOSER</CHOOSER>
        <REGION>experiential-functions</REGION>
        <METAFUNCTION>IDEATIONAL</METAFUNCTION>
    </SYSTEM>
    <SYSTEM>
        <SYSTEM-TYPE>SYSTEM</SYSTEM-TYPE>
        <NAME>POSSESSIVE-TYPE</NAME>
        <INPUTS>
            <s>possessive</s>
        </INPUTS>
        <OUTPUTS>
            <out>
                <probability>0.5</probability>
                <feature>ownership&amp;belonging</feature>
            </out>
            <out>
                <probability>0.5</probability>
                <feature>part&amp;part-of</feature>
            </out>
        </OUTPUTS>
        <CHOOSER>POSSESSIVE-TYPE-CHOOSER</CHOOSER>
        <REGION>experiential-functions</REGION>
        <METAFUNCTION>IDEATIONAL</METAFUNCTION>
    </SYSTEM>
    <SYSTEM>
        <SYSTEM-TYPE>SYSTEM</SYSTEM-TYPE>
        <NAME>INCIDENCE-TYPE</NAME>
        <INPUTS>
            <s>incidence</s>
        </INPUTS>
        <OUTPUTS>
            <out>
                <probability>0.5</probability>
                <feature>circumstance</feature>
            </out>
            <out>
                <probability>0.5</probability>
                <feature>circumhabence</feature>
            </out>
        </OUTPUTS>
        <CHOOSER>INCIDENCE-TYPE-CHOOSER</CHOOSER>
        <REGION>experiential-functions</REGION>
        <METAFUNCTION>IDEATIONAL</METAFUNCTION>
    </SYSTEM>
    <SYSTEM>
        <SYSTEM-TYPE>SYSTEM</SYSTEM-TYPE>
        <NAME>POSSESSIVE2-TYPE</NAME>
        <INPUTS>
            <s>possessive2</s>
        </INPUTS>
        <OUTPUTS>
            <out>
                <probability>0.25</probability>
                <feature>thing-with-parts</feature>
            </out>